{"artifact_class":"a0-calibration-summary","claim_ids":[],"empirical":true,"evidence_eligible":false,"expert_validated":false,"limitations":["Calibration tests a procedural operator proxy, not the TRIZ construct.","No model activation or sealed outcome is inspected in this phase."],"power_status":"pass","protocol_id":"a0-automated-weak-proxy-v1.0.3","protocol_status":"frozen","scientific_status":"exploratory","sealed_targets_accessed":false,"selected":{"critical_successes":19,"families_per_domain":4,"family_count":24,"minimum_detectable_effect":0.333212784429589,"permutation_budget":199},"shortcut_status":"pass","status":"pass"}
